{
  "schema_version": 1,
  "researched_on": "2026-11-01",
  "title": "LitMundi Translation Gap Atlas — bounded evidence survey",
  "purpose": "Separate documented competing editions from unverified absence, access, quality and demand hypotheses. This research does not authorize publication.",
  "target_languages": [
    {
      "code": "vi",
      "name": "Vietnamese",
      "role": "priority",
      "reviewers_committed": 0
    },
    {
      "code": "id",
      "name": "Indonesian",
      "role": "research_comparator_only",
      "reviewers_committed": 0
    }
  ],
  "second_language_decision": {
    "status": "not_approved_for_translation_production",
    "rationale": "Indonesian offers inspectable national/public-library records and active literary publishers, enabling a meaningful comparator. No qualified reviewer capacity or superior unmet demand was verified.",
    "approval_conditions": [
      "A bounded bibliography review establishes a specific access, completeness or reuse need.",
      "Two independent bilingual literary reviewers explicitly agree to the selected source-language pair.",
      "Observe reader demand before committing production."
    ]
  },
  "methodology": {
    "researcher_kind": "ai_assisted",
    "coverage": "20 named works and 40 work-language assessments; web-indexed catalogs, national bibliographies, publishers, translator publications and original-source witnesses.",
    "limitations": [
      "This is a reproducible first-pass survey, not a comprehensive bibliographic census. Most negative searches used public web indexes, not complete internal national-library catalogs.",
      "Search results may be stale; access methods and failures are recorded in source records. Dynamic inventory or search counters are not demand measurements.",
      "No claim of nonexistent translation, unavailable translation, independently proven inadequate translation or globally cleared rights is made.",
      "No reader study, human reviewer recruitment or human literary certification was completed by this survey."
    ],
    "confidence_definition": {
      "high": "Positive item-level metadata or credited translation; confidence applies to existence only.",
      "medium": "Named edition, research or collection evidence with unresolved attribution or coverage.",
      "low": "Bounded search did not establish an edition; no confidence in absence."
    },
    "verified_gap_requirement": "At least two named bibliographic sources, documented scope and search variants, plus attributable human specialist verification. Empty search results alone cannot receive verified_gap.",
    "quality_requirement": "An inadequate_translation claim requires a version-specific independent bilingual assessment, errors and review evidence; none is asserted here."
  },
  "legal_evidence_ids": [
    "us-rights",
    "vn-rights",
    "id-rights",
    "spain-rights"
  ],
  "sources": [
    {
      "id": "wilde-ucc",
      "title": "University College Cork CELT: The Artist",
      "url": "https://celt.ucc.ie/document/E850003-016/",
      "kind": "institutional_edition",
      "accessed_on": "2026-11-01",
      "access_method": "search_index_excerpt",
      "finding": "Identifies the 1913 Methuen Essays and Lectures witness, pp.229–230, and composition/publication context 1894."
    },
    {
      "id": "wilde-pg",
      "title": "Project Gutenberg: Essays and Lectures",
      "url": "https://www.gutenberg.org/files/774/774-h/774-h.htm",
      "kind": "original_text",
      "accessed_on": "2026-11-01",
      "access_method": "search_index_excerpt",
      "finding": "English transcription includes all five paragraphs of The Artist."
    },
    {
      "id": "wilde-tienve",
      "title": "Tiền Vệ: Người nghệ sĩ, Hoàng Ngọc-Tuấn translation",
      "url": "https://tienve.org/home/literature/viewLiterature.do?action=viewArtwork&artworkId=5215",
      "kind": "translation_publication",
      "accessed_on": "2026-11-01",
      "access_method": "search_index_excerpt",
      "finding": "Search-indexed literary publication identifies Wilde, The Artist in Vietnamese, and translator Hoàng Ngọc-Tuấn.",
      "limitation": "Normalized canonical query URL; full-page retrieval returned HTTP 429. Indexed result used a session-bearing URL. Current accessibility and complete text must be rechecked; the index is positive evidence of a translation, not a license grant."
    },
    {
      "id": "machado-usp",
      "title": "Biblioteca Brasiliana Guita e José Mindlin: Várias histórias",
      "url": "https://digital.bbm.usp.br/handle/bbm/5307",
      "kind": "library_catalog",
      "accessed_on": "2026-11-01",
      "access_method": "search_index_excerpt",
      "finding": "University of São Paulo catalog identifies the 1896 Laemmert first edition; A cartomante pp.9–29 and Um apólogo pp.253–257; facsimile is linked."
    },
    {
      "id": "machado-mec",
      "title": "Brazil Ministry of Education Domínio Público: Um Apólogo",
      "url": "https://dominiopublico.mec.gov.br/pesquisa/DetalheObraForm.do?co_obra=1980&select_action=",
      "kind": "institutional_edition",
      "accessed_on": "2026-11-01",
      "access_method": "search_index_excerpt",
      "finding": "Lists the Portuguese work and USP-linked text. Its access counter is not evidence of Vietnamese or Indonesian demand."
    },
    {
      "id": "machado-mec-text",
      "title": "Domínio Público: Um Apólogo text",
      "url": "https://dominiopublico.mec.gov.br/download/texto/ua000231.pdf",
      "kind": "original_text",
      "accessed_on": "2026-11-01",
      "access_method": "search_index_excerpt",
      "finding": "Government-hosted Portuguese transcription; must be collated with the chosen 1896 witness before import."
    },
    {
      "id": "machado-byu",
      "title": "Brigham Young University: Várias histórias corpus",
      "url": "https://machado.byu.edu/corpus/varias-historias/",
      "kind": "institutional_bibliography",
      "accessed_on": "2026-11-01",
      "access_method": "search_index_excerpt",
      "finding": "Lists Um apólogo (1885) and A cartomante (1884) among the collection contents."
    },
    {
      "id": "machado-vn-catalog",
      "title": "Ho Chi Minh City General Sciences Library: Brazilian literature catalog",
      "url": "https://phucvu.thuvientphcm.gov.vn/Item/SearchAdvanced?DDC=869",
      "kind": "library_catalog",
      "accessed_on": "2026-11-01",
      "access_method": "search_index_excerpt",
      "finding": "Lists Nhà điên by Machado de Assis, translated by Đăng Thư, Đà Nẵng, 2021. This is author-level translation evidence; it does not establish that either Atlas story is included."
    },
    {
      "id": "machado-hanu-report",
      "title": "Thời Đại report: Machado de Assis introduction in Vietnam",
      "url": "https://tdnexver.mastercms.org/gioi-thieu-nha-van-vi-dai-cua-van-hoc-brazil-machado-de-assis-den-cong-chung-viet-nam-155254.html",
      "kind": "reported_translation_project",
      "accessed_on": "2026-11-01",
      "access_method": "search_index_excerpt",
      "finding": "2021 event report names a HANU student translation project for A Cartomante and identifies the three other stories in Nhà điên. Completion/publication of that student translation was not verified.",
      "limitation": "Secondary event report; no student manuscript or current project status inspected."
    },
    {
      "id": "machado-senate",
      "title": "Brazilian Senate: diplomatic activity report for Hanoi",
      "url": "https://legis.senado.leg.br/sdleg-getter/documento/download/be5e9644-a9e4-4789-81e5-32a3fdc1d2cb",
      "kind": "official_report",
      "accessed_on": "2026-11-01",
      "access_method": "search_index_excerpt",
      "finding": "Reports a 2021 Machado webinar with Hanoi University’s Portuguese department and the first Vietnamese book translation. Supports an institutional recruitment lead, not anyone’s availability or endorsement."
    },
    {
      "id": "pardo-cervantes-old",
      "title": "Cervantes/Alicante catalog: Cuentos de amor, [1898?]",
      "url": "https://cervantesvirtual.com/obra/cuentos-de-amor/",
      "kind": "library_catalog",
      "accessed_on": "2026-11-01",
      "access_method": "opened_full_page",
      "finding": "Identifies Madrid, Administración, [1898?], Obras completas vol.16; explicitly includes El encaje roto and links the Alicante facsimile."
    },
    {
      "id": "pardo-alicante",
      "title": "University of Alicante: Cuentos de amor facsimile index",
      "url": "https://sirio.ua.es/libros/BEducacion/cuentos_amor/index.htm",
      "kind": "institutional_edition",
      "accessed_on": "2026-11-01",
      "access_method": "opened_full_page",
      "finding": "Facsimile index places El encaje roto on pp.233–239."
    },
    {
      "id": "pardo-cervantes-modern",
      "title": "Cervantes catalog: Cuentos de amor, modern electronic text",
      "url": "https://cervantesvirtual.com/obra/cuentos-de-amor--0/",
      "kind": "library_catalog",
      "accessed_on": "2026-11-01",
      "access_method": "opened_full_page",
      "finding": "The electronic text derives from Aguilar’s 1963 fourth edition, not the 1898 witness. Used for bibliography only; no assumption that modern interventions are freely reusable."
    },
    {
      "id": "pardo-instituto",
      "title": "Instituto Cervantes: Emilia Pardo Bazán biography",
      "url": "https://www.cervantes.es/bibliotecas_documentacion_espanol/creadores/pardo_bazan_emilia.htm",
      "kind": "institutional_bibliography",
      "accessed_on": "2026-11-01",
      "access_method": "search_index_excerpt",
      "finding": "Identifies Pardo Bazán (1851–1921), her literary and feminist work, and death date 12 May 1921."
    },
    {
      "id": "pardo-galicia",
      "title": "Consello da Cultura Galega: El encaje roto",
      "url": "https://consellodacultura.gal/fondos_documentais/tematica.php?f=6437",